{
  "$schema": "http://json-schema.org/draft-06/schema#",
  "$ref": "#/definitions/Works",
  "definitions": {
    "Works": {
      "type": "object",
      "additionalProperties": false,
      "properties": {
        "id": {
          "type": "string"
        },
        "title": {
          "type": "string"
        },
        "description": {
          "type": "string"
        },
        "single_column": {
          "type": "boolean"
        },
        "main_menu": {
          "type": "boolean"
        },
        "items": {
          "type": "array",
          "items": {
            "$ref": "#/definitions/Item"
          }
        }
      },
      "required": [
        "id",
        "description",
        "items",
        "single_column",
        "title"
      ],
      "title": "Works"
    },
    "Item": {
      "type": "object",
      "additionalProperties": false,
      "properties": {
        "id": {
          "type": "string"
        },
        "cover": {
          "type": "string"
        },
        "imagebar": {
          "$ref": "#/definitions/Imagebar"
        },
        "title": {
          "type": "string"
        },
        "client": {
          "$ref": "#/definitions/Client"
        },
        "role": {
          "type": "string"
        },
        "objective": {
          "type": "string"
        },
        "delivered": {
          "type": "string"
        },
        "subtitle": {
          "type": "string"
        },
        "work_done": {
          "type": "array",
          "items": {
            "type": "string"
          }
        },
        "verb": {
          "type": "string"
        },
        "where_to_play": {
          "type": "array",
          "items": {
            "$ref": "#/definitions/WhereToPlay"
          }
        },
        "description": {
          "type": "string"
        },
        "highlight_video": {
          "type": "string"
        }
      },
      "required": [
        "id",
        "subtitle",
        "title",
        "work_done"
      ],
      "title": "Item"
    },
    "Client": {
      "type": "object",
      "additionalProperties": false,
      "properties": {
        "name": {
          "type": "string"
        },
        "url": {
          "type": "string",
          "format": "uri",
          "qt-uri-protocols": [
            "https"
          ]
        }
      },
      "required": [
        "name"
      ],
      "title": "Client"
    },
    "Imagebar": {
      "type": "object",
      "additionalProperties": false,
      "properties": {
        "videos": {
          "type": "array",
          "items": {
            "$ref": "#/definitions/Video"
          }
        },
        "images": {
          "type": "array",
          "items": {
            "type": "string"
          }
        }
      },
      "required": [],
      "title": "Imagebar"
    },
    "Video": {
      "type": "object",
      "additionalProperties": false,
      "properties": {
        "url": {
          "type": "string"
        },
        "autoplay": {
          "type": "boolean"
        }
      },
      "required": [
        "autoplay",
        "url"
      ],
      "title": "Video"
    },
    "WhereToPlay": {
      "type": "object",
      "additionalProperties": false,
      "properties": {
        "url": {
          "type": "string",
          "format": "uri",
          "qt-uri-protocols": [
            "https"
          ]
        },
        "icon": {
          "type": "string"
        },
        "name": {
          "type": "string"
        }
      },
      "required": [
        "icon",
        "name",
        "url"
      ],
      "title": "WhereToPlay"
    }
  }
}
